Brand,Title,Rating,Price
ESPRESSO,95% Viscose/5% Spandex Fishcut Shapewear/Petticoat for Women with Slit,3.2,799
ESPRESSO,95% Viscose/5% Spandex Fishcut Shapewear/Petticoat for Women with Slit,,799
PISARA,Women's Art Silk Printed Saree With Unstitched Blouse Piece,3.2,249
Yashika,Women Art silk Sarees SDPL-SHIMLA PINK,3.4,199
Sidhidata,Women's Georgette Digital Printed Ready To Wear one Minute Saree With Unstitched Blouse Piece,3.5,999
GoSriKi,Women's Georgette Blend Printed Saree With Blouse Piece (MAHA-BLUE-GS_Blue_Free Size),3.2,279
GoSriKi,Women Saree,3.6,279
SIRIL,Women's Printed Poly Silk Saree with Blouse,3.4,269
Yashika,Women's Art Silk Printed Saree With Blouse Piece,3.8,199
MIRCHI FASHION,Women's Latest Chiffon Batik Printed Saree with Blouse Piece,4.0,469
Sidhidata,Women's Nylone Hand Printed Independence Day Tricolor Tiranga Saree With Unstitched Blouse Piece (Tiranga Sareee),,499
SGF11,Women's Kanjivaram Soft Lichi Silk Saree With Blouse Piece,3.9,499
Yashika,Women cotton blend saree SDPL-CHANDRAYAAN,3.6,199
Satrani,Women's Printed Poly Silk Saree with Unstitched Blouse Piece,3.3,245
Yashika,women's art silk banarasi style saree with blouse piece (Multi-Color_Free_Size) SDPL-LILLY,3.3,199
Yashika,Women's Cotton Silk with Blouse Piece,3.5,199
Yashika,Women's Art Silk Saree,3.6,265
Satrani,Women's Knit Cotton Blend Saree (2585S239NA_White & Grey),3.4,359
PERFECTBLUE,Women's Cotton Silk Saree With Blouse Piece,3.7,269
Avantika Fashion,Women's Kanjivaram Soft Silk Banarasi Saree With Blouse Piece,3.5,499
SGF11,Women's Kanjivaram Soft Silk Saree With Blouse Piece,3.5,949
SWORNOF,Women's Lucknowi Chikankari Linen cotton Woven Sarees For Women with Blouse sarees for Women,4.2,949
JALTHER,Jalther Handicrafts Women's Ikat Hand Block Print Jaipuri Cotton Mulmul Saree with Blouse Piece,4.1,729
Yashika,Womens Printed Art Silk Saree With Blouse Piece(RAJARANI CHICKU_Free Size),3.6,265
Yashika,Women's Banarasi Cotton Silk Jacquard Saree With Blouse Piece,4.3,379
SIRIL,Women's Lace & Printed Chiffon Saree with Blouse,3.7,564
DHRUVI TRENDZ,Soft Cotton & Silk Saree For Women Banarasi Saree Under 399 cotton 2022 For Women saree,3.6,265
Satrani,Women's Georgette Bandhani Printed Saree with Blouse Piece,3.5,245
MIRCHI FASHION,Women's Stylish Chiffon Leaf Printed Saree with Blouse Piece,3.8,449
SIRIL,Women's Warli Printed Silk Blend Saree with Unstitched Blouse Piece,3.4,248
Shiv Textiles,Womens Banarasi Silk Saree with Blouse Perfect for Every Occasion,3.8,349
Yashika,Women's Georgette Printed Saree With Blouse Piece(VAMIKA_Free Size),3.5,199
Yashika,Womens Georgette Printed Saree With Blouse Piece,3.6,279
Satrani,Women's Floral Printed Georgette Saree with Blouse Piece,3.5,265
Womanista,Women's Striped Satin Saree (TI2879_Mauve),4.0,739
SIRIL,Women's Leheriya Printed & Lace Georgette Saree with Unstitched Blouse Piece,3.8,979
Yashika,Women's Georgette Saree With Jari & Velvet Blouse with Sequence,4.2,379
Yashika,Women's Lycra Blend Saree With Blouse Piece,4.0,279
SGF11,Women's Kanjivaram Woven Soft Silk Saree With Blouse Piece,4.0,"1,599"
Yashika,Women's Purple Georgette Bandhani Printed Saree with Unstitched Blouse Piece,3.9,279
Satrani,Women's Geometric Printed Poly Silk Saree with Blouse Piece,3.8,329
Yashika,Women's Georgette Printed Saree With Blouse Piece,3.3,269
PERFECTBLUE,Women's Digital Cotton Linen Blend Saree with Unstitched Blouse Piece (DigiPatta_Variation),3.6,369
Rainbow Clothing,handlom cotton silk saree,4.0,510
PYOS,Women's Stylish Printed Saree(Multi colour),,820
Shivanya Handicrafts,Indigo Print Cotton Mulmul Saree for Women Attached Blouse Piece (indigo),4.1,809
Yashika,Women's Georgette Printed Saree Without Blouse Piece,3.4,199
SGF11,Women's Kanjivaram Soft Silk Saree With Blouse Piece,3.7,499
Satrani,Women'S Organza Jacquard Border Saree With Unstitched Blouse Piece,3.4,519
Avantika Fashion,Women's Kanjivaram Lichi Silk Pure Banarasi Sarees With Blouse Piece,5.0,499
Yashika,Womens Art Silk Printed Saree With Blouse Piece,3.2,199
Yashika,Womens Art Silk Printed Saree With Blouse Piece,3.2,199
PERFECTBLUE,Women's Cotton Blend Saree with Blouse Piece,3.3,279
Yashika,women's Art Silk Saree With Blouse Piece,4.0,199
Glory Sarees,Women's Kanchipuram Art Silk Saree With Blouse Piece,3.9,559
SGF11,Women's Kanjivaram Soft Lichi Silk Saree With Blouse Piece,4.2,899
Yashika,Women's Cotton Blend Printed Saree With Blouse Piece,3.8,329
Yashika,Women Art silk saree SDPL-BANDHANI CHECKS J,3.4,199
SIRIL,Women's Bandhani Printed Chiffon Saree with Blouse,3.8,599
Yashika,Women's Printed Georgette With Lace Saree With Blouse Piece,3.8,359
Amazon Brand - Myx,Women Women Saree,4.3,456
SIRIL,Women's Floral Printed Georgette Saree with Unstitched Blouse Piece,3.4,269
Satrani,Women's Printed Khadi Silk Saree with Blouse Piece,3.6,255
GoSriKi,Women's Georgette Blend with Blouse Piece Embroidery Saree (Glass Black Free Size),3.9,519
SIRIL,Women's Floral Printed Georgette Saree with Unstitched Blouse Piece,3.8,289
Satrani,Women's Floral Printed Georgette Saree with Blouse Piece,3.6,255
SGF11,Women's Kanjivaram Pure Soft Silk Handloom Saree Pure Golden Zari With Blouse Piece,4.5,"1,499"
SIRIL,Women's Floral Print Geoegette Saree with Unstitched Blouse Piece,,279
Yashika,Women's Georgette Printed Saree Without Blouse Piece,3.3,199
Shopaz,Kanjivaram Kanchipuram Soft Cotton Linen Silk Transparent Saree with Blouse Piece for Women,3.3,997
Yashika,Women Art Silk Lace Printed Saree Free Size (AIR),3.6,265
Dhavan Fashion,Faux Georgette Saree | sarees for women latest design | sarees for women party wear | sarees for women latest design 2023 | georgette sarees for women,5.0,999
SGF11,Women's Kanjivaram Pure Soft Silk Handloom Saree Pure Golden Zari With Blouse Piece,4.1,"1,599"
DHRUVI TRENDZ,Women's Cotton Silk Saree,4.0,265
OM SAI LATEST CREATION,Women Soft Cotton Silk Banarasi Saree for women Under 300 2022 Beautiful saree free size with blouse piece Saree,3.8,265
Yashika,Women's Art Silk Printed Saree With Blouse Piece,3.8,199
Avantika Fashion,Women's Kanjivaram Soft Lichi Silk Saree With Blouse Piece,3.8,499
SIRIL,Women's Bandhani Printed & Embroidery Work In Lace Georgette Saree with Unstitched Blouse Piece,3.7,979
Bee M Pee Designer,Women's Cotton Blend Saree,3.6,399
SIRIL,Women's Bandhani Printed Georgette Saree with Unstitched Blouse Piece,3.4,269
Sidhidata,Women's Kanjivaram Banarasi Paithani Jacquard Silk Saree With Unstitched Blouse Piecee (Silk Golamor),3.3,299
Shiv Textiles,Shiv Textiles Women's Pure Georgette Saree With Blouse Piece,3.8,699
GoSriKi,Women's Art Silk Saree,3.9,359
Sidhidata,Textile Women's Digital Floral Printed Pure Cotton Linen Saree With Unstitched Blouse Piece,3.8,649
SWORNOF,Women's Banarasi Patola Silk Blend Saree with Blouse Piece,4.0,949
Womanista,Women's Floral Printed Poly Georgette Saree with Moti Lace (TKIM740_Pink),3.9,659
Avantika Fashion,Women's Kanjivaram Soft Pure Silk Saree With Blouse Piece,4.0,499
PISARA,Women's Art Silk Printed Saree,3.4,279
Yashika,Women's Art Silk Printed Saree With Blouse piece(PUDINA_Free Size),3.6,265
GoSriKi,Women's Georgette Blend Sibori Printed Saree With Blouse Piece (ATARANGI-ORANGE-GS_Orange_Free Size),3.2,279
SIRIL,Women's Floral Printed Chiffon Saree with Blouse,3.9,615
Avantika Fashion,Women's Cotton Linen Saree With Blouse Piece,3.7,499
ZECVA,Women's Kanjivaram Soft Silk Traditional Saree With Attach Unstitched Blouse Piece,3.6,788
Womanista,Women's Batik Print Georgette Saree with Pom (TI1425_Off White & Brown),3.8,679
SIRIL,Women's Floral Printed Georgette Saree With Unstitched Blouse Piece,3.7,479
SIRIL,Women's Bandhani Printed & Lace Chiffon Saree with Blouse,3.9,549
SGF11,Women's Kanjivaram Soft Lichi Silk Saree With Blouse Piece,3.5,899
SIRIL,Women's Georgette Bandhani Printed Saree with Blouse,3.6,259
SIRIL,Women's Chiffon Printed Saree with Blouse Piece,3.5,379
SGF11,Women's Kanjivaram Soft Silk Saree With Blouse Piece,3.8,759
SGF11,Women's Kanjivaram Soft Silk Saree With Blouse Piece,3.8,759
Sidhidata,Women's Full Crushed Digital Printed Pure Georgette Saree With Unstitched Blouse Piece (Yellow),4.0,892
MIRCHI FASHION,Women's Stylish Chiffon Kalamkari Printed Saree with Blouse Piece,3.7,449
MIRCHI FASHION,Women's Stylish Chiffon Leaf and Checked Print Saree with Blouse Piece,3.7,469
Yashika,Womens Georgette Prined Saree With Blouse Piece,3.4,199
EthnicJunction,Women's Silk Blend Bandhani Printed Saree With Blouse Piece (EJ7090-Babita-Pink_Pink),1.0,199
Yashika,Women's Polyester Saree,3.7,199
DHRUVI TRENDZ,Soft Cotton & Silk Saree For Women Half Sarees Under 449 2020 Beautiful For Women saree free size with blouse piece,3.7,395
SERONA FABRICS,Women's Assam Cotton Silk With Golden Border Thread Embroidery Saree With Blouse Piece,4.1,875
SIRIL,Women's Printed Georgette Saree with Unstitched Blouse Piece,3.5,279
Shiv Textiles,Women's Banarasi Silk Saree With Unstitched Blouse (Red),3.7,499
SIRIL,Women's Tassel & Self Woven Cotton Silk Saree with Unstitched Blouse Piece,3.8,499
SIRIL,Women's Floral Printed Georgette Saree with Blouse Combo Pack Of 2,3.5,449
Womanista,Women's Floral Printed Poly Georgette Saree with Mirror Lace (TKIM811_Black),4.0,639
Yashika,Womens Solid Net Saree With Blouse Piece,3.7,279
Yashika,Women's Georgette Printed Saree With Blouse Piece,4.0,199
SWORNOF,Womens Kanjivaram Banarasi Silk Saree Kanchipuram Patola saree,4.2,"1,599"
Sidhidata,Textile Women's Banarasi Soft Silk Saree With Unstitched Blouse Piece (Free Size),3.4,399
neeah,Women's Banarasi Art Silk Saree With Unstitched Blouse Piece,3.8,799
Winza Designer,Women's Chiffon Brasso Printed Saree with Blouse Piece (PS Brasso Gagan_W),3.9,480
JALTHER,Handicrafts Women's Ikat Hand Block Print Jaipuri Cotton Mulmul Saree with Blouse Piece,3.9,729
Lymio,Lycra Saree Shapewear Petticoat for Women || saree shapewear for women (SS),4.1,249
Shiv Textiles,Women's Polyester Ready To Wear Saree With Golden Belt Or Unstitched Blouse Piece.,3.5,849
Yashika,Womens Art Silk Printed Saree With Blouse Piece,3.4,279
Satrani,Women's Georgette Floral Printed Saree With Blouse Piece,3.5,255
RANI SAAHIBA,Women's Pure Cotton Printed Saree Without Blouse Piece,3.9,549
Sidhidata,Women's Kota Doria Pure Cotton Saree With Unstiched Blouse Piece,3.7,299
SIRIL,Women's Floral Printed Georgette Saree with Unstitched Blouse Piece,3.5,299
Pratham Blue,Women's Sequins Georgette Fancy Saree With Blouse Piece,3.8,839
Yashika,Women Art silk Sarees SDPL-METRO,3.4,265
Dhavan Fashion,sarees for women | saree embroidery | saree gerogette | saree 999 | saree for women | saree 1000 | new fashion saree 2023 | sari for women | saree | sari,,999
SIRIL,Women's Floral Printed Georgette Saree with Unstitched Blouse Piece,3.6,269
Sidhidata,Women's Temple Border Kota Doria Cotton Manipuri Saree With Unstiched Blouse Piece,3.8,449
MIRCHI FASHION,Women's Stylish Chiffon Contrast Border-Pallu Printed Saree with Blouse Piece,3.5,449
Kiaaron,Women's Ikat Hand Block Print Jaipuri Cotton Mulmul Saree with Blouse Piece,3.9,749
Satrani,Women'S Printed Poly Cotton Saree With Unstitched Blouse Piece,3.3,469
RANI SAAHIBA,Women's Chiffon Pachranga Bandhej Saree Without Blouse Piece (SKR6830_Multicolor),3.4,319
Anand Sarees,Women's Cotton Saree With Blouse Piece,3.7,279.
JALTHER,Jalther Handicrafts Women's Ikat Hand Block Print Jaipuri Cotton Mulmul Saree with Blouse Piece,3.7,729
SOURBH,Cotton Blend Mix 2-Tone Foil Printed Womens Saree New with Blouse Piece,3.7,499
Sidhidata,Women's Printed Pure Georgette Saree With Unstitched Blouse Piece (Rocky Aur Rani Ki Prem Kahani Saree),,699
NPLASH FASHION,Womens Silk Saree,3.7,"1,349"
SGF11,Women's Kanjivaram Soft Silk Saree With Blouse Piece (Light Blue-SGF56),3.5,949
SGF11,Women's Kanjivaram Soft Lichi Silk Saree With Blouse Piece (Light Lavender),4.0,999
Amazon Brand - Anarva,Women's Kashmiri Pashmina Jamawar Woven Banarasi Silk Saree With Blouse Piece,4.2,"1,589"
Yashika,Women's Art Silk Saree With Blouse Piece(NAURTA_N),3.7,265
SOURBH,Women's Faux Georgette Bandhani Printed Embellished Saree with Blouse Piece,3.5,449
DHRUVI TRENDZ,Soft Cotton Saree For Women Saree Under 299 2022 banarasi silk sarees 2022 Women saree,3.7,265
